input,subject,subject_type,relation,object,object_type
第2章知识图谱表示与建模漆桂林东南大学，潘志霖阿伯丁大学，陈华钧浙江大学知识图谱表示（Knowledge_Graph_Representation）指的是用什么语言对知识图谱进行建模，从而可以方便知识计算。,知识图谱表示,,,对知识图谱进行建模,
第2章知识图谱表示与建模漆桂林东南大学，潘志霖阿伯丁大学，陈华钧浙江大学知识图谱表示（Knowledge_Graph_Representation）指的是用什么语言对知识图谱进行建模，从而可以方便知识计算。,知识图谱表示,,,Knowledge_Graph_Representation,
从图的角度来看，知识图谱是一个语义网络，即一种用互联的节点和弧表示知识的一个结构[1]。,知识图谱,,,语义网络,
从图的角度来看，知识图谱是一个语义网络，即一种用互联的节点和弧表示知识的一个结构[1]。,知识图谱,,,语义网络,
语义网络中的节点可以代表一个概念（concept）、一个属性（attribute）、一个事件（event）或者一个实体（entity）；而弧表示节点之间的关系，弧的标签指明了关系的类型。,节点,,,概念,
语义网络中的节点可以代表一个概念（concept）、一个属性（attribute）、一个事件（event）或者一个实体（entity）；而弧表示节点之间的关系，弧的标签指明了关系的类型。,节点,,,属性,
语义网络中的节点可以代表一个概念（concept）、一个属性（attribute）、一个事件（event）或者一个实体（entity）；而弧表示节点之间的关系，弧的标签指明了关系的类型。,节点,,,事件,
语义网络中的节点可以代表一个概念（concept）、一个属性（attribute）、一个事件（event）或者一个实体（entity）；而弧表示节点之间的关系，弧的标签指明了关系的类型。,节点,,,实体,
语义网络中的语义主要体现在图中边的含义。,语义网络中的语义,,,边的含义,
为了给这些边赋予语义，研究人员提出了术语语言（Terminological_Language），并最终提出了描述逻辑（Description_Logic），描述逻辑是一阶谓词逻辑的一个子集，推理复杂度是可判定的。,描述逻辑,,,一阶谓词逻辑,
为了给这些边赋予语义，研究人员提出了术语语言（Terminological_Language），并最终提出了描述逻辑（Description_Logic），描述逻辑是一阶谓词逻辑的一个子集，推理复杂度是可判定的。,描述逻辑,,,Description_Logic,
W3C采用了以描述逻辑为逻辑基础的本体语言OWL作为定义Web术语的标准语言。,OWL,,,定义Web术语的标准语言,
W3C采用了以描述逻辑为逻辑基础的本体语言OWL作为定义Web术语的标准语言。,OWL,,,描述逻辑为逻辑基础的本体语言,
W3C还推出了另外一种用于表示Web本体的语言RDF_Schema（简称RDFS）。,RDFS,,,W3C推出的另一种用于表示Web本体的语言,
目前基于向量的知识表示开始流行，这类表示将知识图谱三元组中的主谓宾表示成数值向量，通过向量的知识表示，可以采用统计或者神经网络的方法进行推理，对知识图谱中的实体直接的关系进行预测。,基于向量的知识表示的推理,,,知识图谱三元组中的主谓宾表示成数值向量,
目前基于向量的知识表示开始流行，这类表示将知识图谱三元组中的主谓宾表示成数值向量，通过向量的知识表示，可以采用统计或者神经网络的方法进行推理，对知识图谱中的实体直接的关系进行预测。,向量的知识表示的推理,,,基于向量的知识表示,
本章将对知识表示的常见方法进行介绍，并且讨论如何用这些知识表示方法对知识进行建模。,本章内容,,,知识表示的常见方法,
2.1什么是知识表示20世纪90年代，MIT_AI实验室的R.Davis定义了知识表示的五大用途或特点：●客观事物的机器标示（A_KR_is_a_Surrogate），即知识表示首先需要定义客观实体的机器指代或指称。,知识表示的五大用途或特点,,,定义客观实体的机器指代或指称,
2.1什么是知识表示20世纪90年代，MIT_AI实验室的R.Davis定义了知识表示的五大用途或特点：●客观事物的机器标示（A_KR_is_a_Surrogate），即知识表示首先需要定义客观实体的机器指代或指称。,知识表示的五大用途或特点,,,客观事物的机器标示,
●一组本体约定和概念模型（A_KR_is_a_Set_of_Ontological_Commitments），即知识表示还需要定义用于描述客观事物的概念和类别体系。,一组本体约定和概念模型,,,知识表示,
●一组本体约定和概念模型（A_KR_is_a_Set_of_Ontological_Commitments），即知识表示还需要定义用于描述客观事物的概念和类别体系。,一组本体约定和概念模型,,,A_KR_is_a_Set_of_Ontological_Commitments,
●支持推理的表示基础（A_KR_is_a_Theory_of_Intelligent_Reasoning），即知识表示还需要提供机器推理的模型与方法。,支持推理的表示基础,,,知识表示,
●用于高效计算的数据结构（A_KR_is_a_medium_for_Efficient_Computation），即知识表示也是一种用于高效计算的数据结构。,知识表示的五大用途或特点,,,用于高效计算的数据结构,
●人可理解的机器语言（A_KR_is_a_Medium_of_Human_Expression），即知识表示还必须接近于人的认知，是人可理解的机器语言。,知识表示的五大用途或特点,,,人可理解的机器语言（A_KR_is_a_Medium_of_Human_Expression）,
●人可理解的机器语言（A_KR_is_a_Medium_of_Human_Expression），即知识表示还必须接近于人的认知，是人可理解的机器语言。,知识表示的五大用途或特点,,,人可理解的机器语言,
有关知识表示的研究可以追溯到人工智能的早期研究。,有关知识表示的研究,,,人工智能的早期研究,
例如，认知科学家M.RossQuillian和Allan_M.Collins提出了语义网络的知识表示方法[2-3]，以网络的方式描述概念之间的语义关系。,语义网络的知识表示方法,,,概念之间的语义关系,
例如，认知科学家M.RossQuillian和Allan_M.Collins提出了语义网络的知识表示方法[2-3]，以网络的方式描述概念之间的语义关系。,语义网络的知识表示方法,,,语义网络,
典型的语义网络如WordNet属于词典类的知识库，主要定义名词、动词、形容词和副词之间的语义关系。,WordNet,,,词典类的知识库,
典型的语义网络如WordNet属于词典类的知识库，主要定义名词、动词、形容词和副词之间的语义关系。,语义网络,,,WordNet,
20世纪70年代，随着专家系统的提出和商业化发展，知识库构建和知识表示更加得到重视。,知识库构建,,,知识表示,
传统的专家系统通常包含知识库和推理引擎（InferenceEngine）两个核心模块。,传统的专家系统,,,知识库和推理引擎（InferenceEngine）两个核心模块,
传统的专家系统通常包含知识库和推理引擎（InferenceEngine）两个核心模块。,知识库,,,KnowledgeBase,
传统的专家系统通常包含知识库和推理引擎（InferenceEngine）两个核心模块。,推理引擎,,,InferenceEngine,
无论是语义网络，还是框架语言和产生式规则，都缺少严格的语义理论模型和形式化的语义定义。,语义网络,,,语义理论模型,
无论是语义网络，还是框架语言和产生式规则，都缺少严格的语义理论模型和形式化的语义定义。,框架语言,,,形式化的语义定义,
无论是语义网络，还是框架语言和产生式规则，都缺少严格的语义理论模型和形式化的语义定义。,产生式规则,,,缺少严格的语义理论模型和形式化的语义定义,
为了解决这一问题，人们开始研究具有较好的理论模型基础和算法复杂度的知识表示框架。,知识表示的五大用途或特点,,,较好的理论模型基础和算法复杂度的知识表示框架,
比较有代表性的是描述逻辑语言（Description_Logic）[4]。,描述逻辑语言,,,描述逻辑,
比较有代表性的是描述逻辑语言（Description_Logic）[4]。,描述逻辑语言,,,Description_Logic,
描述逻辑是目前大多数本体语言（如OWL）的理论基础。,本体语言,,,描述逻辑,
第一个描述逻辑语言是1985年由RonaldJ.Brachman等提出的KL-ONE[5]。,KL-ONE,,,第一个描述逻辑语言,
第一个描述逻辑语言是1985年由RonaldJ.Brachman等提出的KL-ONE[5]。,KL-ONE,,,第一个描述逻辑语言,
描述逻辑主要用于刻画概念（Concepts）、属性（Roles）、个体（Individual）、关系（Relationships）、元语（Axioms，即逻辑描述Logic_Statement）等知识表达要素。,描述逻辑,,,刻画概念（Concepts）、属性（Roles）、个体（Individual）、关系（Relationships）、元语（Axioms，即逻辑描述Logic_Statement）等知识表达要素,
描述逻辑主要用于刻画概念（Concepts）、属性（Roles）、个体（Individual）、关系（Relationships）、元语（Axioms，即逻辑描述Logic_Statement）等知识表达要素。,描述逻辑,,,描述逻辑,
与传统专家系统的知识表示语言不同，描述逻辑家族更关心知识表示能力和推理计算复杂性之间的关系，并深入研究了各种表达构件的组合带来的查询、分类、一致性检测等推理计算的计算复杂度问题。,描述逻辑家族,,,关心知识表示能力和推理计算复杂性之间的关系,
语义网的基础数据模型RDF受到了元数据模型、框架系统和面向对象语言等多方面的影响，其最初是为人们在Web上发布结构化数据提供一个标准的数据描述框架。,语义网的基础数据模型RDF,,,为人们在Web上发布结构化数据提供一个标准的数据描述框架,
与此同时，语义网进一步吸收描述逻辑的研究成果，发展出了用OWL系列标准化本体语言。,语义网,,,描述逻辑的研究成果,
无论是早期专家系统时代的知识表示方法，还是语义网时代的知识表示模型，都属于以符号逻辑为基础的知识表示方法。,早期专家系统时代的知识表示方法,,,以符号逻辑为基础的知识表示方法,
无论是早期专家系统时代的知识表示方法，还是语义网时代的知识表示模型，都属于以符号逻辑为基础的知识表示方法。,早期专家系统时代的知识表示方法,,,以符号逻辑为基础的知识表示方法,
无论是早期专家系统时代的知识表示方法，还是语义网时代的知识表示模型，都属于以符号逻辑为基础的知识表示方法。,语义网时代的知识表示模型,,,以符号逻辑为基础的知识表示方法,
符号知识表示的特点是易于刻画显式、离散的知识，因而具有内生的可解释性。,符号知识表示的特点,,,易于刻画显式、离散的知识，因而具有内生的可解释性,
符号知识表示的特点是易于刻画显式、离散的知识，因而具有内生的可解释性。,符号知识表示的特点,,,易于刻画显式、离散的知识，因而具有内生的可解释性,
但由于人类知识还包含大量不易于符号化的隐性知识，完全基于符号逻辑的知识表示通常由于知识的不完备而失去鲁棒性，特别是推理很难达到实用。,知识表示的鲁棒性,,,基于符号逻辑的知识表示,
由此催生了采用连续向量的方式来表示知识的研究。,连续向量的方式来表示知识,,,采用连续向量的方式来表示知识的研究,
基于向量的方式表示知识的研究由来已有。,基于向量的方式表示知识的研究,,,基于向量表示知识的研究,
随着表示学习的发展，以及自然语言处理领域词向量等嵌入（Embedding）技术手段的出现，启发了人们用类似于词向量的低维稠密向量的方式表示知识。,表示学习,,,表示知识,
随着表示学习的发展，以及自然语言处理领域词向量等嵌入（Embedding）技术手段的出现，启发了人们用类似于词向量的低维稠密向量的方式表示知识。,表示学习,,,表示学习的发展,
通过嵌入将知识图谱中的实体和关系投射到一个低维的连续向量空间，可以为每一个实体和关系学习出一个低维度的向量表示。,向量空间,,,将知识图谱中的实体和关系投射到一个低维的连续向量空间,
通过嵌入将知识图谱中的实体和关系投射到一个低维的连续向量空间，可以为每一个实体和关系学习出一个低维度的向量表示。,向量空间,,,embedding,
这种基于连续向量的知识表示可以实现通过数值运算来发现新事实和新关系，并能更有效发现更多的隐式知识和潜在假设，这些隐式知识通常是人的主观不易于观察和总结出来的。,基于连续向量的知识表示,,,通过数值运算来发现新事实和新关系，并能更有效发现更多的隐式知识和潜在假设,
这种基于连续向量的知识表示可以实现通过数值运算来发现新事实和新关系，并能更有效发现更多的隐式知识和潜在假设，这些隐式知识通常是人的主观不易于观察和总结出来的。,基于连续向量的知识表示,,,基于连续向量的知识表示,
更为重要的是，知识图谱嵌入也通常作为一种类型的先验知识辅助输入很多深度神经网络模型中，用来约束和监督神经网络的训练过程。,知识图谱嵌入,,,先验知识辅助输入很多深度神经网络模型中，用来约束和监督神经网络的训练过程,
更为重要的是，知识图谱嵌入也通常作为一种类型的先验知识辅助输入很多深度神经网络模型中，用来约束和监督神经网络的训练过程。,知识图谱嵌入,,,knowledge graph embedding,
如图2-1所示为基于离散符号的知识表示与基于连续向量的知识表示对比。,基于离散符号的知识表示,,,基于连续向量的知识表示对比,
如图2-1所示为基于离散符号的知识表示与基于连续向量的知识表示对比。,基于离散符号的知识表示,,,基于离散符号的知识表示,
图2-1基于离散符号的知识表示与基于连续向量的知识表示对比综上所述，与传统人工智能相比，知识图谱时代的知识表示方法已经发生了很大的变化。,知识表示方法,,,基于离散符号的知识表示与基于连续向量的知识表示对比,
由于知识表示涉及大量传统人工智能的内容，并有其明确、严格的内涵及外延定义，为避免混淆，在本书中主要侧重于知识图谱的表示方法的介绍，因此用“知识表示”和“知识图谱的表示方法”加以了区分。,知识表示,,,“知识表示”,
2.2人工智能早期的知识表示方法知识是智能的基础。,知识,,,智能的基础,
人类智能往往依赖有意或无意运用已知的知识。,人类智能,,,依靠已知的知识,
人类智能往往依赖有意或无意运用已知的知识。,人类智能的运用,,,已知知识,
与此类似，人工智能系统需要获取并运用知识。,人工智能系统,,,获取并运用知识,
这里有两个核心问题：怎么表示知识？怎样在计算机中高效地存储与处理知识？本章主要阐述第一个核心问题。,本章,,,阐述第一个核心问题,
2.2.1一阶谓词逻辑一阶谓词逻辑（或简称一阶逻辑）（First_Order_Logic）是公理系统的标准形式逻辑。,一阶谓词逻辑,,,公理系统的标准形式逻辑,
不同于命题逻辑（Propositional_Logic），一阶逻辑支持量词（Quantifier）和谓词（Predicate）。,一阶逻辑,,,命题逻辑,
不同于命题逻辑（Propositional_Logic），一阶逻辑支持量词（Quantifier）和谓词（Predicate）。,一阶逻辑,,,First-Order_Logic,
例如，在命题逻辑里，以下两个句子是不相关的命题：“John_MaCarthy是图灵奖得主”（p）、“Tim_Berners-Lee是图灵奖得主”（q）。,p,,,命题逻辑,
例如，在命题逻辑里，以下两个句子是不相关的命题：“John_MaCarthy是图灵奖得主”（p）、“Tim_Berners-Lee是图灵奖得主”（q）。,等价,,,等价,
但是，在一阶逻辑里，可以用谓词和变量表示知识，例如，图灵奖得主（x）表示x是图灵奖得主。,一阶逻辑,,,用谓词和变量表示知识,
但是，在一阶逻辑里，可以用谓词和变量表示知识，例如，图灵奖得主（x）表示x是图灵奖得主。,一阶逻辑,,,first-order logic,
"这里，图灵奖得主是一元谓词（Predicate）,x是变量（Variable），图灵奖得主（x）是一个原子公式（Atomic_Formula）。",图灵奖得主,,,一元谓词,
"这里，图灵奖得主是一元谓词（Predicate）,x是变量（Variable），图灵奖得主（x）是一个原子公式（Atomic_Formula）。",一元谓词,,,Predicate,
"这里，图灵奖得主是一元谓词（Predicate）,x是变量（Variable），图灵奖得主（x）是一个原子公式（Atomic_Formula）。",x,,,变量,
"这里，图灵奖得主是一元谓词（Predicate）,x是变量（Variable），图灵奖得主（x）是一个原子公式（Atomic_Formula）。",图灵奖得主（x）,,,一个原子公式,
Ø图灵奖得主（x）是一个否定公式（Negated_Formula）。,图灵奖得主（x）,,,否定公式（Negated_Formula）,
在上面的例子中，若x为John_MaCarthy，图灵奖得主（x）为第一个命题p。,图灵奖得主,,,第一个命题p,
在上面的例子中，若x为John_MaCarthy，图灵奖得主（x）为第一个命题p。,图灵奖得主,,,第一个命题p,
若x为Tim_Berners-Lee，图灵奖得主（x）为第二个命题q。,图灵奖得主,,,Tim_Berners-Lee,
若x为Tim_Berners-Lee，图灵奖得主（x）为第二个命题q。,图灵奖得主,,,第二个命题q,
1.一阶谓词逻辑优点●结构性。,一阶谓词逻辑优点,,,结构性,
能把事物的属性以及事物间的各种语义联想显式地表示出来。,概念/SPO,,,能把事物的属性以及事物间的各种语义联想显式地表示出来。,
●严密性。,SPO,,,概念/产品,
有形式化的语法和语义，以及相关的推理规则。,本体,,,形式化的语法和语义以及相关的推理规则,
●可实现性。,SPO,,,可实现性,
可以转换为计算机内部形式，以便用算法实现。,概念/转换,,,计算机内部形式,
2.一阶谓词逻辑缺点●有限的可用性。,一阶谓词逻辑缺点,,,有限的可用性。,
一阶逻辑的逻辑归结只是半可判定性的。,一阶逻辑,,,半可判定性,
●无法表示不确定性知识。,OWL_2_CRS,,,无法表示不确定性知识,
2.2.2霍恩子句和霍恩逻辑霍恩子句（Horn_Clause）得名于逻辑学家Alfred_Horn[6]。,霍恩子句,,,霍恩逻辑,
2.2.2霍恩子句和霍恩逻辑霍恩子句（Horn_Clause）得名于逻辑学家Alfred_Horn[6]。,霍恩子句,,,Horn_Clause,
一个子句是文字的析取。,子句,,,文字的析取,
霍恩子句是带有最多一个肯定（positive）文字的子句，肯定文字指的是没有否定符号的文字。,霍恩子句,,,带有最多一个肯定（positive）文字的子句,
霍恩子句是带有最多一个肯定（positive）文字的子句，肯定文字指的是没有否定符号的文字。,霍恩子句,,,Horn clause,
例如，Øp1∨…∨Øpn∨_q是一个霍恩子句，它可以被等价地写为（p1∧…∧pn）→q。,霍恩子句,,,等价地写为（p1∧…∧pn）→q,
Alfred_Horn于1951年撰文指出这种子句的重要性。,Alfred_Horn,,,撰文指出这种子句的重要性,
霍恩逻辑（Horn_Logic）是一阶逻辑的子集。,霍恩逻辑,,,一阶逻辑,
基于霍恩逻辑的知识库是一个霍恩规则的集合。,基于霍恩逻辑的知识库,,,霍恩规则的集合,
基于霍恩逻辑的知识库是一个霍恩规则的集合。,基于霍恩逻辑的知识库,,,基于霍恩规则的集合,
"一个霍恩规则由原子公式构成：B1∧…∧Bn→H，其中H是头原子公式，B1,…,Bn是体原子公式。",霍恩规则,,,原子公式构成,
"一个霍恩规则由原子公式构成：B1∧…∧Bn→H，其中H是头原子公式，B1,…,Bn是体原子公式。",霍恩规则,,,Horn规则,
事实是霍恩规则的特例，它们是没有体原子公式且没有变量的霍恩Berners-Lee）是一个事实，可以简写为图灵奖得主规则。,事实,,,霍恩规则的特例,
事实是霍恩规则的特例，它们是没有体原子公式且没有变量的霍恩Berners-Lee）是一个事实，可以简写为图灵奖得主规则。,霍恩规则的特例,,,Horn的特例,
例如，→图灵奖得主（Tim（Tim_Berners-Lee）。,图灵奖得主,,,Tim（Tim_Berners-Lee）,
1.霍恩逻辑的优点●结构性。,霍恩逻辑的优点,,,结构性,
能把事物的属性以及事物间的各种语义联想显式地表示出来。,概念/SPO,,,能把事物的属性以及事物间的各种语义联想显式地表示出来。,
●严密性。,SPO,,,概念/产品,
有形式化的语法和语义，以及相关的推理规则。,本体,,,形式化的语法和语义以及相关的推理规则,
●易实现性。,易实现性,,,SPO三元组,
可判定，可以转换为计算机内部形式，以便用算法实现。,可判定,,,转换为计算机内部形式，以便用算法实现。,
2.霍恩逻辑的缺点●有限的表达能力。,霍恩逻辑的缺点,,,有限的表达能力,
不能定义类表达式，不能够任意使用量化。,类表达式,,,不能定义类表达式,
不能定义类表达式，不能够任意使用量化。,不能定义类表达式,,,cannot define class expression,
不能定义类表达式，不能够任意使用量化。,不能够任意使用量化,,,cannot use quantification arbitrarily,
●无法表示不确定性知识。,OWL_2_CRS,,,无法表示不确定性知识,
2.2.3语义网络语义网络是由Quillian等人提出用于表达人类的语义知识并且支持推理[3]。,语义网络,,,用于表达人类的语义知识并且支持推理,
2.2.3语义网络语义网络是由Quillian等人提出用于表达人类的语义知识并且支持推理[3]。,语义网络,,,semantic network,
语义网络又称联想网络，它在形式上是一个带标识的有向图。,语义网络,,,联想网络,
语义网络又称联想网络，它在形式上是一个带标识的有向图。,语义网络,,,联想网络,
图中“节点”用以表示各种事物、概念、情况、状态等。,节点,,,概念/产品,
每个节点可以带有若干属性。,节点,,,属性,
节点与节点间的“连接弧”（称为联想弧）用以表示各种语义联系、动作。,节点,,,“连接弧”,
节点与节点间的“连接弧”（称为联想弧）用以表示各种语义联系、动作。,节点,,,“连接弧”,
语义网络的单元是三元组：（节点1，联想弧，节点2）。,语义网络的单元,,,三元组,
语义网络的单元是三元组：（节点1，联想弧，节点2）。,三元组,,,三元组：（节点1，联想弧，节点2）。,
例如（Tim_Berners-Lee，类型，图灵奖得主）和（Tim_Berners-Lee，发明，互联网）是三元组。,Tim_Berners-Lee,,,图灵奖得主,
例如（Tim_Berners-Lee，类型，图灵奖得主）和（Tim_Berners-Lee，发明，互联网）是三元组。,Tim_Berners-Lee,,,互联网,
例如（Tim_Berners-Lee，类型，图灵奖得主）和（Tim_Berners-Lee，发明，互联网）是三元组。,Tim_Berners-Lee,,,图灵奖得主,
例如（Tim_Berners-Lee，类型，图灵奖得主）和（Tim_Berners-Lee，发明，互联网）是三元组。,Tim_Berners-Lee,,,互联网,
由于所有的节点均通过联想弧彼此相连，语义网络可以通过图上的操作进行知识推理。,语义网络,,,图上的操作进行知识推理,
由于所有的节点均通过联想弧彼此相连，语义网络可以通过图上的操作进行知识推理。,语义网络,,,semantic network,
1.语义网络的优点1）联想性。,语义网络的优点,,,联想性,
它最初是作为人类联想记忆模型提出来的。,联想记忆模型,,,作为人类联想记忆模型提出,
2）易用性。,2）易用性。,,,SPO三元组,
3）结构性。,SPO,,,结构性,
语义网络是一种结构化的知识表示方法，对数据子图特别有效。,语义网络,,,结构化的知识表示方法,
它能把事物的属性以及事物间的各种语义联想显式地表示出来。,概念/语义联想,,,事物的属性以及事物间的各种语义联想,
2.语义网络的缺点1）无形式化语法。,语义网络的缺点,,,无形式化语法,
语义网络表示知识的手段多种多样，虽然灵活性很高，但同时也由于表示形式的不一致提高了对其处理的复杂性。,语义网络,,,表示知识的手段多种多样,
语义网络表示知识的手段多种多样，虽然灵活性很高，但同时也由于表示形式的不一致提高了对其处理的复杂性。,语义网络表示知识的手段,,,semantic network representation knowledge,
例如，“每个学生都读过一本书”可以表示为多种不同的语义网络，例如图2-2和图2-3中的语义网络。,语义网络,,,表示为多种不同的语义网络,
例如，“每个学生都读过一本书”可以表示为多种不同的语义网络，例如图2-2和图2-3中的语义网络。,语义网络,,,"semantic network, ",
